{
  "$schema": "https://json-schema.org/draft/2020-12/schema",
  "$id": "https://github.com/Verjson/.github/blob/main/docs/decisions/0078-container-release-and-runner-deployment-contract/candidate-config.schema.json",
  "title": "Container candidate publisher configuration",
  "type": "object",
  "required": ["repository", "registryNamespace", "nextStableVersion", "images"],
  "properties": {
    "repository": {"type": "string", "minLength": 1},
    "registryNamespace": {"type": "string", "pattern": "^ghcr\\.io/[a-z0-9]+$"},
    "nextStableVersion": {
      "type": "string",
      "pattern": "^(0|[1-9][0-9]*)\\.(0|[1-9][0-9]*)\\.(0|[1-9][0-9]*)$"
    },
    "cleanupUnusedDockerImages": {
      "type": "boolean",
      "default": false,
      "description": "On isolated GitHub-hosted candidate build jobs, remove only unused image IDs present before the job initializes Buildx. No image cleanup is performed by default."
    },
    "privateNodePackages": {
      "type": "array",
      "items": {
        "type": "string",
        "pattern": "^@[a-z0-9][a-z0-9._-]*/[a-z0-9][a-z0-9._-]*$"
      },
      "uniqueItems": true
    },
    "packageManager": {"type": "string", "enum": ["npm", "pnpm"], "default": "npm"},
    "registryDestinations": {
      "type": "array",
      "minItems": 1,
      "items": {
        "type": "object",
        "required": ["provider", "namespace"],
        "properties": {
          "provider": {"type": "string", "enum": ["ghcr", "gar"]},
          "namespace": {"type": "string", "minLength": 1},
          "candidateRetentionDays": {"type": "integer", "minimum": 1},
          "project": {"type": "string"},
          "location": {"type": "string"},
          "repository": {"type": "string"},
          "serviceAccount": {"type": "string"}
        },
        "additionalProperties": true
      }
    },
    "images": {
      "type": "array",
      "minItems": 1,
      "items": {
        "type": "object",
        "required": ["variant", "repository", "platforms"],
        "properties": {
          "variant": {"type": "string", "minLength": 1},
          "repository": {"type": "string", "minLength": 1},
          "baseVariant": {"type": "string"},
          "context": {"type": "string", "default": "."},
          "file": {"type": "string", "default": "Dockerfile"},
          "target": {"type": "string"},
          "platforms": {
            "type": "array",
            "minItems": 1,
            "items": {
              "type": "object",
              "required": ["os", "architecture"],
              "properties": {
                "os": {"type": "string", "minLength": 1},
                "architecture": {"type": "string", "minLength": 1},
                "variant": {"type": "string"}
              },
              "additionalProperties": true
            }
          },
          "provenance": {
            "type": "object",
            "properties": {
              "predicateType": {"type": "string", "minLength": 1},
              "builderIdentity": {"type": "string", "minLength": 1}
            },
            "additionalProperties": true
          }
        },
        "additionalProperties": true
      }
    }
  },
  "additionalProperties": true
}
