{
  "repository": "verJSON/.github",
  "registryNamespace": "ghcr.io/verjson",
  "nextStableVersion": "0.0.1",
  "cleanupUnusedDockerImages": true,
  "images": [
    {
      "variant": "contract-canary",
      "repository": "ghcr.io/verjson/container-candidate-contract",
      "context": "scripts/fixtures/container-candidate/canary",
      "file": "scripts/fixtures/container-candidate/canary/Dockerfile",
      "platforms": [
        {"os": "linux", "architecture": "amd64"}
      ],
      "provenance": {
        "predicateType": "https://slsa.dev/provenance/v1",
        "builderIdentity": "verJSON/.github/.github/workflows/container-candidate-publish.yml@refs/heads/main"
      }
    }
  ]
}
